"～もの（です）か","決して～ない （強い否定の意味を表す。）:Quyết không ~ (Ý phủ định mạnh)","名詞修飾型＋ものか （ただし［名－の］は［名－な］になる。）","あの人が人の忠告なんか聞くものですか。:Người kia quyết không nghe lời khuyên của người khác.<br>歯医者に行くのがこわいんでしょう。こわいもんか。時間がないだけだよ。:Đi nha sĩ thì sợ à. Sợ đâu. Không có thời gian thôi.<br>ご迷惑じゃありませんか。迷惑なものですか。ぜひいらっしゃってください。:Không biết có phiền bác không? Phiền là phiền là thế nào. Nhất định đến đấy nhé.<br>あの絵が名作なものか。ピカソの模倣にすぎない。:Bức tranh kia nhất định không phải danh tác. Chỉ là mô phỏng bức của Picasso thôi.","N2","1",",173nguphapn2,lesson14,",""
"～ものだ／～ものではない(1)","（感嘆・嘆息・心に深く感ずることを表す。）:Thể hiện cảm xúc mạnh, cảm thán, thở dài","［動・い形・な形］の名詞修飾型＋ものだ","あんな大事故にあって、よく助かったものだ。:Gặp tai nạn lớn thế mà được cứu sống hết.<br>いつか京都に行ってみたいものだ。:Lúc nào đấy rất muốn đi Kyoto.<br>時間のたつのは早いものですね。:Thời gian trôi qua thật là nhanh nhỉ.","N2","2",",173nguphapn2,lesson14,",""
"～ものだ／～ものではない(2)","（当然・常識と思えることを言う時の表現。）:Nói về thứ được coi là tự nhiên, thướng thức","［動・い形・な形］の名詞修飾型＋ものだ","地震の時は、だれでも慌てるものだ。:Lúc động đất thì ai cũng cuống cuồng.<br>年末は、だれでも忙しいものだ。:Cuối năm thì ai cũng bận.","N2","3",",173nguphapn2,lesson14,",""
"～ものだ／～ものではない(3)","（助言・軽い命令を表す。 ）:Lời khuyên, mệnh lệnh nhẹ nhàng","［動－辞書形］＋ものだ","人の話はよく聞くものです。:Cần phải nghe kỹ câu chuyện của người khác.<br>人の陰口を言うものではありません。:Không được nói xấu sau lưng người khác.","N2","4",",173nguphapn2,lesson14,",""
"～ものだ／～ものではない(4)","（過去の状態やよく起こったことを思い出して言う時の表現。）:Nhớ về việc đã xảy ra lâu trong quá khứ","［動・い形・な形］の普通形の過去＋ものだ","子供のころ、いたずらをして、よく父に叱られたものだ。:Hồi bé thường nghịch ngợp, hay bị bố mắng.<br>この辺は、昔は静かだったものだ。:Khu này trước đây yên tĩnh lắm.","N2","5",",173nguphapn2,lesson14,",""
"～わけだ(1)","（理由があるから、そうなるのは当然だと言いたい時に使う。 ）:Vì có lý do nên muốn nói như thế là đương nhiên.","［動・い形・な形］の名詞修飾型＋わけだ","暗いわけだ。蛍光灯:けいこうとう<br>が１本切れている。<br>Tối là phải. Một bóng đèn huỳnh quang bị cháy.<br>ジョンさんは、お母さんが日本人ですから、日本語が上手なわけです。:Anh John có mẹ là người Nhật nên tiếng Nhật giỏi là phải.","N2","6",",173nguphapn2,lesson14,",""
"～わけだ(2)","（成り行きから、そうなると言いたい時の表現。）:Do quá trình, nên muốn nói sự việc trở nên thế. Tức là ~, là thế","［動・い形・な形］の名詞修飾型＋わけだ","５パーセントの値引きというと、１万円の物は 9500 円になるわけですね。:Nói là giảm 5% giá, tức là hàng 1 man thì còn 9500Y nhỉ.<br>はじめは観光旅行のつもりで日本へ遊びに来たんですが、日本が好きになり、とうとう１０年も日本に住んでしまったわけです。:Ban đầu đến Nhật là định du lịch ngắm cảnh quan, đâm ra thích Nhật Bản, cuối cùng là sống đến 10 năm ở Nhật là như thế.","N2","7",",173nguphapn2,lesson14,",""
"～わけではない／～わけでもない","特に～ではない・必ずしも～ではない:Không nhất thiết là ~, không phải là ~","［動・い形・な形］の名詞修飾型＋わけではない","生活に困っているわけではないが、貯金する余裕はない。:Cuộc sống không phải là khó khăn nhưng cũng không có dư ra để dành.<br>彼の気持ちがわからないわけでもありませんが、やはり彼の意見には賛成できません。:Không phải là tôi không hiểu tâm trạng anh ấy, nhưng mà rõ ràng tôi cũng không tán thành ý kiến anh ta.<br>甘い物が嫌いなわけではありませんが、ダイエットしているんです。:Không phải tôi ghét đồ ngọt đâu nhưng mà đang ăn kiêng.","N2","8",",173nguphapn2,lesson14,",""
"～っけ","（思い出そうとした、思い出したことを確認する時に使う。）:Đang nhớ ra, nhớ lại và muốn xác nhận lại","［動・い形・な形・名］の普通形＋っけ （ただし［～でしたっけ］［～ましたっけ］も使う。）","彼にはまだパーティーの場所を知らせていなかったっけ。:Hình như tôi chưa báo cho anh ấy địa điểm liên hoan hay sao ấy.<br>学生時代は楽しかったね。そうそう、一緒によく卓球したっけね。:Lúc học sinh vui thật đấy nhỉ. Ừa ừa, mình cùng nhau hay chơi bóng bàn hay sao ấy nhỉ.<br>あのレストランで送別会しない。あそこ 50 人入れるほど広かったっけ。:Không tổ chức tiệc chia tay ở nhà hàng đó. Đằng kia hình như chứa được tầm 50 người, rộng rãi lắm.<br>そうだ。今日はお母さんの誕生日だっけ。:Ừ nhỉ, hôm nay là sinh nhật mẹ hay sao ấy.","N2","9",",173nguphapn2,lesson14,",""
"～とか","～そうだ・～ということだ （間接的情報を表す。）:Nghe nói là ~ (chỉ thông tin mang tính gián tiếp)","［動・い形・な形・名］の普通形＋とか","新聞によると、国内線の飛行機運賃が上がるとか。:Thấy báo nói giá cước vận chuyển hàng không tuyến nội địa tăng giá thì phải.<br>先生は来週、お忙しいとか。お宅に伺うのは、再来週にしませんか。:Thầy giáo tuần sau bận thì phải ạ. Hay để tuần sau nữa em đến thăm nhà ạ.<br>昨日はこの冬一番の寒さだったとか。:Hôm qua thấy bảo là lạnh nhất mùa đông năm nay.<br>木村さんのお父さんも学校の先生だとか伺いました。:Nghe nói bố của anh Kimura cũng là thầy giáo.<br>近々日本へいらっしゃるとか。ぜひお会いしたいものです。（手紙）:Nghe thấy gần đây bác vẫn đến Nhật. Nhất định em muốn được gặp.","N2","10",",173nguphapn2,lesson14,",""
"～どころではない／～どころではなく","事情があって、～できない:Có lý do, chịu không thể ~","［動－辞書形］,［名］ ＋どころではない","人の仕事を手伝うどころではありません。自分の仕事も間に合わないんです。:Việc của người khác thì chịu không giúp được rồi. Việc của mình còn đang lỡ dở đây.<br>せっかく海へ行ったのに、寒くて泳ぐどころではなかった。:Khó khăn lắm mới đi được biển, thế mà lạnh quá không thể bơi được.<br>年末から母の入院で、お正月どころではありませんでした。:Từ cuối năm mẹ phải nhập viện, chả còn Tết nhất gì cả.<br>引っ越しの前の晩は、食事どころではなく、夜遅くまで荷作りが終わらなかった。:Đêm trước khi chuyển nhà thì chả có thời gian mà ăn uống, đóng đồ đến đêm muộn mà chả xong.","N2","1",",173nguphapn2,lesson15,",""
"～からして(1)","（一つの例をあげて、ほかももちろんだがという気持ちを表す。）:Đưa ra một ví dụ, nghĩ là những cái khác là đương nhiên. Ngay cả ~","［名］＋からして","彼は礼儀を知らない。あいさつからして、きちんとしていない。:Anh ta chả biết lễ nghi gì cả. Đến chào hỏi còn chả thèm.<br>田舎は空気からして違う。:Ở quê thì ngay cả không khí cũng khác.<br>この映画はこわいそうですね。題名からしてこわそうですね。:Bộ phim này có vẻ ghê nhỉ. Ngay cái tít thôi cũng sợ rồi.","N2","2",",173nguphapn2,lesson15,",""
"～からして(2)","～から判断して （推量の根拠を示す。）:Từ ~ mà phán đoán… (chỉ căn cứ của suy đoán)","［名］＋からして","窓ガラスが破られていることからして、泥棒はここから行ったに違いない。:Nhìn kính cửa sổ vỡ thế này, chắc hẳn kẻ trộm đã vào theo đường này.<br>彼の健康状態からして、登山は無理だろう。:Xem tình trạng sức khoẻ anh ta thế, leo lúi làm sao được.","N2","3",",173nguphapn2,lesson15,",""
"～からすると／～からすれば(1)","～の立場から見ると:Nhìn từ lập trường của ~","［名］＋からすると","親からすると、子供はいくつになっても子供で、心配なものだ。:Với bố mẹ thì con cái có lớn thế nào thì vẫn lo lắng cho chúng.<br>日本人からすれば当たり前なことでも、外国人にとっては変だと思うこともある。:Theo cách nhìn của người Nhật, có những việc là đương nhiên nhưng đối với người nước ngoài lại nghĩ là lạ lẫm.","N2","4",",173nguphapn2,lesson15,",""
"～からすると／～からすれば(2)","～から判断すると （推量の根拠を示す。）:Phán đoán từ ~ (Chỉ căn cứ cho suy luận)","［名］＋からすると","あの車は形からすると 10 年ぐらい前のものだと思う。:Nhìn vào hình dáng của cái ô tô kia, tôi nghĩ nó là vật từ 10 năm trước.<br>彼女の能力からすれば、A 大学に十分合格できるだろう。:Xét về năng lực của cô ấy, chắc là đủ sức đỗ đại học A.","N2","5",",173nguphapn2,lesson15,",""
"～からには／～からは","～のだから当然:Chừng nào ~ , vì là ~, đương nhiên","［動・い形・な形・名］の普通形＋からには （ただし［な形］と［名］は［である］を使う。）","試合に出るからには、勝ちたい。:Đã tham gia vào cuộc chơi, tất nhiên là muốn thắng.<br>約束したからには、守らなければいけない。:Đã hứa rồi thì phải giữ lời.<br>高価なものがこんなに安いからには、何か欠陥があるに違いない。:Đồ đắt giá mà giá rẻ thế này hẳn là có khiếm khuyết gì đây.<br>自分で選んだ道であるからには、最後までやりぬくつもりだ。:Vì là con đường tự mình chọn, tôi định sẽ thực hiện đến cùng.<br>日本に来たからは、自分の専門の勉強だけでなく日本の文化も学ぼう。:Vì đã đến Nhật rồi thì không chỉ học về chuyên môn của bản thân mà còn muốn học về văn hoá Nhật nữa.","N2","6",",173nguphapn2,lesson15,",""
"～ことだから","（皆が知っている理由を示す。後ろに推量の文がくる。）:Trình bày lý do mà mọi người đều biết, theo sau là câu suy luận.","［名－の］＋ことだから","子供のことだから、少しぐらいいたずらをしても仕方がないです。:Vì là trẻ con nên có nghịch một tí cũng không có cách nào.<br>あなたのことだからきっといい論文が書けると思います。:Anh thì em nghĩ chắc chắn sẽ viết được một luận văn tốt.<br>心の優しい林さんのことだから、喜んでボランティアに参加してくれるでしょう。:Vì là anh Hayashi người có trái tim nhân hậu nên là anh ấy sẽ rất vui tham gia vào công việc tình nguyện.","N2","7",",173nguphapn2,lesson15,",""
"～だけ／～だけあって／～だけに／～だけの(1)","～にふさわしく （［～だけ］［～だけあって］［～だけに］［～だけの］が使われる。）:Phù hợp với, quả đúng là, đúng là….có khác","［動・い形・な形・名］の名詞修飾型＋だけ （ただし［名－の］の［の］はつかない。）","この仕事は努力しただけ成果が現れるので、やりがいがある。:Công việc này có thành quả thể hiện ra phù hợp với những nỗ lực bỏ ra nên tôi thấy rất có ý nghĩa.<br>この大学は歴史が長いだけあって伝統がある。:Trường Đại học này có bề dày truyền thống tương xứng với chiều dài lịch sử<br>彼女はアメリカに留学しただけに英語がうまいね。:Quả đúng là đã từng du học ở Mỹ , cô ấy rất giỏi tiếng Anh<br>林さんはセールスマンだけに話が上手だ。:Quả đúng là Salesman, anh Hayashi nói chuyện rất hay.<br>さすがに最高級と言われるワインだけのことはある。味も香りもすばらしい。:Đúng là loại vang được mệnh danh là cao cấp nhất. Cả hương và vị đều rất tuyệt vời.","N2","8",",173nguphapn2,lesson15,",""
"～だけ／～だけあって／～だけに／～だけの(2)","～だからいっそう （［～だけに］が使われる。）:Chính vì là…nên càng…","［動・い形・な形・名］の名詞修飾型＋だけ （ただし［名－の］の［の］はつかない。）","今日の試合は優勝がかかっているだけに大勢のファンが詰めかけ熱烈な応援をしていた。:Trận đấu lần này chính vì là quyết định xem đội nào sẽ vô địch nên lượng người hâm mộ tập trung để<br>cổ vũ càng đông đảo và cuồng nhiệt.<br>昨年はみかんが不作で、値段が高かっただけに今年の豊作がうれしい。:Chính vì năm ngoái mất mùa quýt, giá cao nên năm nay được mùa tôi lại càng vui.","N2","9",",173nguphapn2,lesson15,",""
"～だけ／～だけあって／～だけに／～だけの(3)","～の限度まですべて （［～だけ］［～だけの］が使われる。）:Tất cả cho đến giới hạn…","［動・い形・な形］の名詞修飾型＋だけ","考えるだけ考えたが結論は出なかった。:Tôi đã nghĩ hết nước có thể nhưng cũng không ra được kết luận.<br>欲しいだけ本が買えたらどんなにいいだろう。:Giá mà tôi có thể mua tất cả sách mình mong muốn thì tốt biết mấy.<br>普段は忙しくて寝る時間も十分ないので、休みの日は好きなだけ寝ています。:Ngày thường tôi rất bận rộn đến thời gian ngủ cũng không đủ, cho nên ngày nghỉ tôi ngủ bao nhiêu tùy thích.<br>目標を達成するためには、できるだけの努力をするつもりです。:Để đạt được mục tiêu, tôi sẽ nỗ lực hết khả năng có thể.","N2","10",",173nguphapn2,lesson15,",""
"～にあたって／～に当たり","～の時に （何かをすべき特別の機会や場合を示す。）:Trong khi… (Dùng trong trường hợp, cơ hội đặc biệt)","［動－辞書形］,［名］ ＋にあたって","開会にあたって、ひとことごあいさつ申し上げます。:Khai mạc hội nghị, tôi xin có một vài lời chào.<br>新製品を開発するにあたり、強力なプロジェクトチームが作られた。:Khi phát triển sản phẩm mới, một đội dự án mạnh đã được lập ra.<br>新年にあたり、決心を新たにした。:Vào thời điểm năm mới, tôi đã làm mới quyết tâm của bản thân.","N2","1",",173nguphapn2,lesson16,",""
"～にかけては／～にかけても","～について言えば:Nếu nói về…","［名］＋にかけては","数学にかけては、彼女はクラスでいつも一番だった。:Nếu nói về số học thì cô ấy là giỏi nhất lớp.<br>走ることにかけては、だれにも負けないつもりだ。:Về môn chạy thì tôi quyết là sẽ không thua ai.<br>彼は優れた技術者だが、経営にかけても才能を発揮した。:Anh ấy là một chuyên viên kỹ thuật xuất sắc nhưng về kinh doanh anh cũng phát huy tài năng của mình.","N2","2",",173nguphapn2,lesson16,",""
"～に際して／～に際し／～に際しての","～を始める時に・～をしている時に:Khi bắt đầu…, Khi đang…","［動－辞書形］,［名］ ＋に際して","留学に際して、先生や友人から励ましの言葉をもらった。:Khi đang du học, tôi đã nhận được nhiều lời động viên từ thầy cô và bè bạn.<br>帰国に際し、お世話になった人にあいさつの手紙を出した。:Khi về nước, tôi đã viết thư chào hỏi những người đã giúp đỡ mình.<br>計画を変更するに際しての問題点を検討する。:Chúng tôi đang xem xét những vấn đề khi thay đổi kế hoạch.","N2","3",",173nguphapn2,lesson16,",""
"～に先立って／～に先立ち／～に先立つ","～の前に・～より先に:Trước khi...","［名］＋に先立って","映画の一般公開に先立って、主演女優のサイン会が開かれた。:Trước khi công chiếu bộ phim, lễ ký tặng của nữ diễn viên chính đã được tổ chức.<br>高層マンションの建設に先立って、住民と建設会社との話し合いが行われた。:Trước khi xây dựng các tòa nhà chung cư cao tầng, người ta tổ chức các cuộc thảo luận giữa dân chúng và công ty xây dựng.<br>入社試験に先立ち、会社説明会が行われた。:Trước kì thi vào công ty, người ta tổ chức buổi giới thiệu về công ty ấy.<br>首脳会議に先立つ事務レベルの協議で、共同宣言の案が作られた。:Ở hội nghị cấp thư ký trước hội nghị thượng đỉnh, người ta đã đưa ra dự thảo tuyên bố chung.","N2","4",",173nguphapn2,lesson16,",""
"～にしたら／～にすれば／～にしても","～の立場で言うと:Nếu nói trên lập trường…, nhìn từ suy nghĩ của…, đối với…","［名］＋にしたら","あの人にしたら、私たちの親切はかえって迷惑かもしれません。:Nếu nhìn từ suy nghĩ của người đó, có thể sự tốt bụng của chúng ta ngược lại đem đến phiền phức.<br>学生にすれば、休みは長ければ長いほどいいだろう。:Đối với sinh viên có lẽ kì nghỉ càng dài càng tốt.<br>あなたにすれば、つまらないことかもしれませんが、私には大切なのです。:Đối với bạn có thể là một việc chán ngắt nhưng đối với tôi thì nó lại rất mực quan trọng.<br>社会ルールを守ることは、小さな子供にしても同じです。:Việc tôn trọng những quy tắc trong xã hội là giống nhau đối với cả những đứa trẻ.","N2","5",",173nguphapn2,lesson16,",""
"～につき","～なので:Vì…","［名］＋につき","雨天につき、試合は延期いたします。:Vì trời mưa nên trận đấu đã bị hoãn.<br>教授の海外出張につき休講。:Vì giảng viên đi công tác nước ngoài nên nghỉ học.<br>店内改装につき、しばらく休業いたします。:Vì sửa sang lại cửa hàng nên chúng tôi sẽ tạm nghỉ trong một thời gian.","N2","6",",173nguphapn2,lesson16,",""
"～につけ／～につけて（は）／～につけても(1)","～するたびに:Mỗi lần làm…","［動－辞書形］＋につけ","家族の写真を見るにつけ、会いたくてたまらなくなる。:Mỗi lần nhìn ảnh gia đình tôi lại muốn gặp mọi người không chịu nổi.<br>戦争のニュースを聞くにつけ、心が痛む。:Mỗi lần nghe tin chiến tranh, lòng tôi lại đau thắt.","N2","7",",173nguphapn2,lesson16,",""
"～につけ／～につけて（は）／～につけても(2)","～の場合にも・～の場合も:Trong trường hợp…cũng…","［動－辞書形］,［い形－い］,［名］＋につけ ［動－辞書形］,［い形－い］,［名］ ＋につけ","先輩の活躍を見るにつけ聞くにつけ、心強くなる。:Mỗi lần nhìn, nghe các hoạt động của các anh chị khóa trên, tôi lại thấy thêm mạnh mẽ.<br>暑いにつけ寒いにつけ、うちのおばあさんは体の調子が悪いと言う。:Lúc nóng, lúc lạnh, bà tôi đều nói là người không khỏe.<br>雨につけ雪につけ、工事の遅れが心配された。:Lúc mưa, lúc có tuyết rơi tôi đều lo lắng bị muộn công trình.","N2","8",",173nguphapn2,lesson16,",""
"～のもとで／～のもとに","～のしたで （影響や条件の範囲内で、あることが行われることを表す。 ）:Dưới…(Trong phạm vi ảnh hưởng, trong điều kiện…mà một việc được tiến hành)","［名］＋のもとで","鈴木教授のご指導のもとで、卒業論文を完成させた。:Dưới sự chỉ đạo của thầy Suzuki, tôi đã hoàn thành khóa luận tốt nghiệp.<br>国連から派遣された医師団のもとで救援活動が続けられた。:Dưới sự hướng dẫn của đoàn bác sĩ được phái đến từ LHQ, các hoạt động viện trợ đã được tiếp tục.<br>植民地の人々は独立と自由の名のもとに戦った。:Người dân các vùng thuộc địa đã chiến đấu dưới khẩu hiệu Độc lập và Tự do.<br>子供の人権は法のもとに守られています。:Quyền của trẻ em được bảo vệ dưới Pháp luật.","N2","9",",173nguphapn2,lesson16,",""
"～はともかく（として）","～のことは考えないで・～は別にして:Tạm thời không nghĩ đến…, Tạm thời gác chuyện…sang một bên","［名］＋はともかく","この洋服は、デザインはともかく、色がよくない。:Bộ quần áo này, tạm thời không nói đến thiết kế, màu sắc đã không đẹp rồi.<br>私は、話すことはともかく、書くことは苦手だ。:Tôi thì không nói đến việc nói, viết đã kém rồi.<br>この店のラーメンは味はともかくとして、値段は安い。:Mì của cửa hàng này, chưa nói đến vị, giá cả khá rẻ rồi.<br>買うかどうかはともかくとして、説明だけでも聞いてください。:Chưa tính đến việc có mua hay không nhưng xin hãy nghe lời giải thích của tôi đã.","N2","10",",173nguphapn2,lesson16,",""
"～をきっかけに（して）／～をきっかけとして","（偶然のできごとから何かが始まったり変わったりすることを表す。）:Biểu thị rằng từ một việc ngẫu nhiên mà có gì đó bắt đầu, thay đổi.","［名］＋をきっかけに","留学をきっかけに、自分の国についていろいろ考えるようになった。:Từ việc đi du học mà tôi đã có nhiều suy nghĩ về đất nước của mình.<br>旅行をきっかけにして、木村さんと親しくなりました。:Từ việc du lịch mà tôi trở nên thân thiết với anh Kimura.<br>一主婦の投書をきっかけとして、町をきれいにする運動が起こった。:Từ bức thư của một bà nội trợ mà đã nổ ra cuộc vận động làm sạch thành phố.","N2","1",",173nguphapn2,lesson17,",""
"～を契機に（して）／～を契機として","（あるできごとから、前の流れがはっきり表れてきたり大きく変わったりすることを表す。）:Nhân cơ hội ~ (Chỉ một việc mà dòng chảy từ trạng thái trước biểu hiện rõ ràng và thay đổi lớn từ một sự kiện nhất định)","［名］＋を契機に","オイルショックを契機に新エネルギーの研究が進められた。:Nhân thời cơ của cuộc khủng hoảng dầu lửa, các nghiên cứu về năng lượng mới đã được đẩy mạnh.<br>明治維新を契機にして、日本は近代国家への道を歩みをはじめた。:Nhân cuộc duy tân Meiji, Nhật Bản đã bắt đầu tiến trình theo con đường của các nước hiện đại.<br>新製品の開発を契機として、大きく会社が発展した。:Công ty đã phát triển mạnh mẽ với việc phát triển sản phẩm mới.","N2","2",",173nguphapn2,lesson17,",""
