"はじめまして。私はアンナです","Xin chào.Tôi là Anna.","N4","1",",speedN4,lesson1,"
"はじめまして。さくらです","Xin chào. Tôi là Sakura.","N4","2",",speedN4,lesson1,"
"よろしくお願いします","Rất hân hạnh được làm quen.","N4","3",",speedN4,lesson1,"
"こちらこそ","Tôi cũng rất hân hạnh được gặp chị","N4","4",",speedN4,lesson1,"
"さくらさん。はい、どうぞ。","Chị Sakura này, xin tặng chị.","N4","1",",speedN4,lesson2,"
"これは何ですか","Đây là cái gì thế?","N4","2",",speedN4,lesson2,"
"それはタイのお土産です","Đấy là món quà lưu niệm của Thái Lan.","N4","3",",speedN4,lesson2,"
"ありがとうございます","Xin cảm ơn chị.","N4","4",",speedN4,lesson2,"
"どういたしまして","Không có gì ạ.","N4","5",",speedN4,lesson2,"